,subreddit,title
0,politics,Live Thread: General Election 2020
1,politics,Discussion Thread: 2020 General Election Part 71 | The Wait Continues
2,politics,Philadelphia: Evacuations underway after bomb threats near vote counting centre
3,politics,Discussion Thread: 2020 General Election Part 69 | Nice
4,politics,Joe Biden's popular vote lead grows to more than 4 million
5,politics,Thank goodness Trump is too incompetent to properly organize a coup
6,politics,Arizona voted to tax the wealthy to pay for public schools
7,politics,America’s Next Authoritarian Will Be Much More Competent
8,politics,Biden doubles lead in Nevada
9,politics,Trump spent years worrying about the stock market only to discover Wall Street doesn’t care if he loses
10,politics,"Citing zero evidence, former House Speaker Newt Gingrich asks Attorney General Bill Barr to send federal agents to arrest election workers in Pennsylvania"
11,politics,"Biden on path to win 306 Electoral College votes, same as Trump's 'landslide' victory in 2016"
12,politics,US Special Council to investigate Trump campaign's use of White House as campaign 'war room'
13,politics,Georgia Voters Can Put an End to Mitch McConnell’s Grim Reaping
14,politics,Secret Service headed to Biden campaign HQ in Wilmington as Biden reportedly prepares to deliver big victory speech
15,politics,Arizona flips! Navajos contribute to historic shift
16,politics,"Biden leads over Trump in Nevada grows to more than 22,000."
17,politics,2 GOP Candidates Who Promoted QAnon Conspiracy Theory Lose Bids for Congress in Illinois
18,politics,Report: Trump Plans to Barricade Himself in the Oval Office and Refuse to Come Out If Biden Wins
19,politics,Joe Biden Likely Has the Votes to Win the Presidency and Don Jr. Is Shitting a Brick
20,politics,Arizona voters approve tax on wealthy to fund public schools
21,politics,Democrats Must Go Down to Georgia to Save Disappearing Hopes of a Senate Majority
22,politics,Black People Repudiated Trump Like He Was a Piece of Used Gum - It’s time for centrist Democrats to stop whining about Black Lives Matters protests and start recognizing that Black voters literally saved the election.
23,politics,CNN reporter says it is 'poetry' that Trump's racist presidency ends with 'black woman in White House'
24,politics,Kellyanne Conway Absurdly Claims Trump Never Declared Victory on Election Night
25,politics,Twitter Permanently Suspends Steve Bannon Account After Beheading Comments
26,politics,Trump tweets Philadelphia has 'rotten history' as city puts Biden on brink of election win
27,politics,International election observer says Trump's false election victory statement was an 'unprecedented abuse of his position'
28,politics,Biden Campaign Says 'Trespassers' Can Be Escorted From the White House If Trump Refuses to Concede
29,politics,John Lewis's former county tipped Biden into lead in Georgia
30,politics,Judge orders Trump administration to reveal PPP loan data it sought to obscure
31,politics,Trump allies reportedly discussing who will have to break the news of his potential loss
32,politics,Biden campaign threatens to ‘escort Trump out of White House’
33,politics,"Alex Jones Tried to Start a Riot Outside an Election Office in Arizona “We’re going to take it to the scumbag Nazi bastards,” the right-wing grifter said. “They will be hiding. They will pay."""
34,politics,"Biden didn’t ‘take the lead’ in Pennsylvania. If he wins, he always had it."
35,politics,A record-breaking 6 Native Americans were elected to Congress on Tuesday
36,politics,Trump asked if he is 'sore loser' by CNN reporter Jim Acosta after baseless rant about election fraud
37,politics,Wisconsin Republicans caught apparently encouraging voter fraud in Pennsylvania
38,politics,"Some Republicans ""not questioning"" mail-in ballots in states they won, Amy Klobuchar says"
39,politics,Discussion Thread: 2020 General Election Part 70 | No Fun Allowed
40,politics,"Fine Print of RNC-Trump ""Election Fraud"" Fundraising Shows Half the Money Can Go to Pay Off Existing Campaign Debt"
41,politics,"If Donald Trump refuses to leave the White House, Secret Service will escort him out"
42,politics,Biden to give prime-time address Friday evening
43,politics,Stacey Abrams Says 'My Heart is Full' As Georgia Poised to Turn Blue For First Time in 28 Years
44,politics,Biden overtakes Trump in Pennsylvania vote count
45,politics,Trump has told people he has no plans to concede even if his path to victory is blocked
46,politics,Biden already looks presidential. Trump never did
47,politics,It's Over: Biden defeats Trump as US voters take the rare step to remove an incumbent president
48,politics,GOP files emergency request at Supreme Court as Biden overtakes Trump's lead in Pennsylvania
49,politics,Kamala Harris makes history as the first woman to become vice president
50,politics,Trump will no longer receive special Twitter treatment if he loses election
51,politics,Trump’s Divorce From Fox News Is Getting Ugly
52,politics,"Philadelphia mayor: Trump should accept loss, put on ‘big boy pants’"
53,politics,Stacey Abrams earns praise as Biden leads in Georgia
54,politics,Steve Bannon’s lawyer quits after Bannon calls for Dr. Fauci to be beheaded
55,politics,Mitt Romney scolds Trump for damaging democracy by making claims that election was rigged
56,politics,Judges Are Rejecting Trump’s False Claims Of Shady Poll Practices After Looking At The Evidence
57,politics,"In Georgia, a Biden supporter realizes the power of her ballot"
58,politics,Georgia will hold a run-off election—giving soon-to-be 18-year-olds a chance to participate
59,politics,Biden campaign on Trump's refusal to concede: 'The US government is perfectly capable of escorting trespassers out of the White House'
60,politics,"Biden widens gap in Georgia, leads Trump by over 4,000 votes"
61,politics,Trump Won’t Be the Last American Populist: The Conditions That Produced Him Need to Be Understood to Be Addressed
62,politics,Trump's odds of winning through a recount are nearly impossible
63,politics,Joe Biden will be 46th president after winning battleground of Pennsylvania
64,politics,"Biden leading Arizona by 39,400 votes"
65,politics,The day the world stopped paying attention to Donald Trump
66,politics,Jake Tapper Pleads With Fox News and Murdochs: Put Your Country Above Your Profits
67,politics,Carolyn Bourdeaux Flips Georgia's 7th District For Democrats
68,politics,Biden to receive additional Secret Service protection: report
69,politics,Video of ‘ballot stuffing’ is not from a Flint polling place. It’s from Russia.
70,politics,Judge Tosses Out Trump Campaign Lawsuit Attempting To Stop Vote Count In Pennsylvania - The lawsuits in Pennsylvania and Georgia were thrown out by federal judges.
71,politics,"Donald Trump, loser: He now has to own the insult he most loves to hurl at others"
72,politics,"Legal problems galore await Trump now that he's lost reelection — and, soon, his presidential immunity"
73,politics,"Nevada attorney general says Trump campaign's voting fraud complaint is ""garbage"""
74,politics,"Commentators marvel at the 'poetry' of Joe Biden potentially winning John McCain's Arizona, John Lewis' Georgia"
75,politics,Black voters delivered for Biden — a President Biden must deliver for them
76,politics,Trump aides reportedly had to explain to the president that his demand to 'Stop The Count' would actually guarantee his loss
77,politics,"Kamala Harris makes history as the first female, Black, and Asian American vice president-elect"
78,politics,US networks pull the plug on Trump’s live address due to ‘lies’
79,politics,USPS finds 815 Texas mail ballots in sweep of facilities on Wednesday
80,politics,Trump says Biden should not 'wrongfully' declare victory after president's illegitimate claims
81,politics,Fox News Gets Ready to Dump Trump
82,politics,QAnon Supporters–Allegedly Armed–Drove to Philadelphia Vote-Counting Center and Were Arrested
83,politics,"BLM activists demanded police accountability. In city after city, voters agreed. - They passed at least 19 of 20 ballot measures designed to curb the power of law enforcement."
84,politics,Trump’s ‘Most Dishonest Speech Ever’ Stuns CNN Fact-Checker
85,politics,"‘Chill Donald, chill!’ Greta Thunberg’s revenge tweet uses Trump’s own words against him"
86,politics,Armed QAnon Follower Arrested in Alleged Philly Convention Center Threat Linked to Far-Right Va. Senator
87,politics,Colorado Cop Put on Leave After Threatening to ‘Beat the Hell’ Out of Democrats
88,politics,Trump lost 4 of the top 5 boat-owning states
89,politics,"Joy Reid: If Joe Biden wins, he will owe his victory to voters of color"
90,politics,"Fine Print of RNC-Trump ""Election Fraud"" Fundraising Shows Half the Money Can Go to Pay Off Existing Campaign Debt"
91,politics,Photo From Trump’s Lie-Filled Rant Goes Viral For The Most Obvious Reason
92,politics,"Trump and His Pathetic Allies Are Yelling About Stealing the Pennsylvania Election or Getting a 'Do-Over' : These people are enemies of democracy. If it's necessary to retain power, they'll get rid of it."
93,politics,Secret Service to dispatch extra protection squad to Joe Biden's campaign headquarters in Delaware
94,politics,Anderson Cooper calls Trump ‘an obese turtle on his back flailing in the hot sun’ – and it’s an image now seared on our retinas
95,politics,"Rashida Tlaib tweeted she will ""break news"" to Donald Trump about election"
96,politics,Congress' QAnoner is already picking fights with her Republican colleagues
97,politics,Trump Is Deliberately Eroding Faith In Democracy. The GOP Is Helping.
98,politics,Republicans who’ve tried to exist in both the MAGAverse and reality are being forced to choose
99,politics,Bernie Sanders Warns 'Authoritarian' Trump is Trying to 'Destroy Faith' in Democracy
100,politics,"Trump ‘considering holding victory rally at weekend' .The president could urge his supporters to gather this weekend for a rally, advisors have said."
101,politics,Stacey Abrams: I think we have a strong chance of delivering Georgia
102,politics,"Trump will be a regular citizen on Twitter when he steps down, beholden to all its rules"
103,politics,"After four years of Trump, 'Sleepy Joe' sounds just fine to Wall Street"
104,politics,Decision Desk HQ Declares Biden Winner After Giving Him Pennsylvania
105,politics,Democrat Mark Kelly defeats Republican Martha McSally in Arizona Senate race
106,politics,"U.S. Postal Service says 1,700 ballots found in Pennsylvania facilities"
107,politics,"Mary Trump says uncle Donald is in 'uncontrollable rage': 'Somebody has to stop him' ‘He’s desperate, he’s flailing, and there’s literally nothing he can do legitimately except to watch this play out helplessly’"
108,politics,"Opinion: If there's any decency left in the GOP, now would be a good time to exercise it"
109,politics,"Discussion Thread: 2020 General Election Part 68 | Updates on GA, PA, and AZ Continue"
110,politics,Joe Biden Has Taken The Lead In The Historically Red State Of Georgia
111,politics,The third-highest ranking Republican in the nation has seen no evidence that former Vice President and candidate Joe Biden has benefitted from improper or illegal votes.
112,politics,Trump is reportedly out for revenge against Fox News
113,politics,Philadelphia mayor says Trump needs to 'put his big boy pants on' and accept defeat
114,politics,"As QAnon Copes With Trump’s Likely Loss, They Wonder Where Q Is"
115,politics,The 'AOC movement' expands in NYC with congressional and Assembly wins
116,politics,Bush 2000 recount lawyer says Trump election suits are 'entirely without merit'
117,politics,Alleged QAnon Goons With AR-15 Arrested Near Vote Center
118,politics,"On Brink of Defeat, Trump Is Losing Control of Republicans"
119,politics,Mitt Romney says Trump’s baseless claims of election fraud ‘wrong’
120,politics,‘Backbone of the #MAGA Movement’: Armed Man Busted Near Philly Vote Center Is ‘Vets for Trump’ Founder
121,politics,Aviation authorities designate 'national defence airspace' over Biden's current location
122,politics,"Hey, Fox News: Go home, you're drunk — it's time to admit that the Trump party's over"
123,politics,"If Donald Trump Refuses to Leave the White House, Secret Service Will Escort Him Out"
124,politics,"Republican officials tried to convince Pennsylvania Trump supporters to cast illegal ballots after Election Day, report says"
125,politics,"Discussion Thread: 2020 General Election Part 66 | Updates on GA, PA, and AZ Continue"
126,politics,The RNC Promoted A Voter Fraud Hotline On Twitter And It Totally Backfired
127,politics,"Discussion Thread: 2020 General Election Part 67 | Updates on GA, PA, and AZ Continue"
128,politics,"Owner of 'Trump Unity Bridge,' a roving shrine to Trump, arrested in Detroit for riding dirty"
129,politics,Biden and Harris won on Nov. 3; counts confirm that today
130,politics,Joe Biden breaks record for most votes ever in a presidential election
131,politics,Republicans must follow Mitt Romney’s example and rebuke Donald Trump
132,politics,Trump calls for ballot counting scenario where votes legally cast by military would be thrown out
133,politics,"Fox News host confronts GOP chair over fraud allegations: ""It doesn't pan out"""
134,politics,John Lewis’s former district may have flipped Georgia blue. It’s seen by some as divine revenge.
135,politics,"WHAT IS HAPPENING? I’m Susan Page, USA TODAY’s Washington Bureau chief, here to answer your questions about the 2020 elections and results. AMA!"
136,politics,Trump unhappy with legal team's lack of major impact on election count
137,politics,Biden poised to move quickly on transition if he's declared winner
138,politics,"Biden's presidency could bring a smoother vaccine rollout and an overall decline in coronavirus cases, experts say"
139,politics,Donald Trump Jr. calls for 'total war' over election votes. That's beyond irresponsible
140,politics,Nashville renames popular street after Civil Rights icon John Lewis
141,politics,"Discussion Thread: 2020 General Election Part 65 | Updates on GA, PA, and AZ Continue"
142,politics,Nevada Democrat Steven Horsford wins reelection
143,politics,America’s Next Authoritarian Will Be Much More Competent
144,politics,Trump-associated firm helped send unmarked texts urging vote protests in Philadelphia
145,politics,"Bill Barr, Trump Henchman, Is Sending Armed Agents to Ballot-Counting Locations"
146,politics,"Trump’s Republican Allies Are Going to Help Him Burn it All Down. As the president takes a blowtorch to American democracy, people like Lindsey Graham and Ted Cruz—who called the process “lawless” and said “everything should be on the table,” respectively—are fanning the flames."
147,politics,Two Men Linked to QAnon Arrested For Plot to Attack Philly Vote Counting Site
148,politics,Supporters of Qanon arrested after tip off of possible attack on the Pennsylvania Convention Center
149,politics,Secret Service plans to ramp up protection of Biden in anticipation of his possible win
150,politics,Discussion Thread: 2020 General Election Part 63 | Updates on GA and PA
151,politics,"As Trump claims election is being stolen, John McCain's concession speech from 2008 goes viral"
152,politics,Decision Desk HQ calls the presidential race for Joe Biden
153,politics,"Biden Supporters Preparing To Celebrate In Wilmington As Former Vice President Holds 13,000-Vote Lead In Pennsylvania"
154,politics,3rd court blocks Trump's order on congressional seat count
155,politics,Discussion Thread: 2020 General Election Part 64 | Updates on GA and PA Continue
156,politics,"Former astronaut Mark Kelly projected to win Arizona Senate race, flipping Republican seat"
157,politics,"As Fox News Support for Trump Wavers, Struggle Breaks Out in Murdoch Family"
158,politics,"Trumpism is a lifestyle disease, chronic in America"
159,politics,New York Democrat Ritchie Torres elected as the first openly gay Black member of Congress
160,politics,"Two men outside Philly vote count in Hummer with QAnon stickers face weapons charges, police say"
161,politics,"Democrats blame gerrymandering, campaign strategy for failure to flip state legislatures"
162,politics,"Romney: Trump is ‘wrong to say that the election was rigged, corrupt and stolen’"
163,politics,Trump advisers are telling him it’s over. There’s some poetic justice here.
164,politics,"America’s anti-democratic Senate, by the numbers If the United States chose its leaders in free and fair elections, Republicans would be firmly out of power."
165,politics,"Discussion Thread: 2020 General Election Part 62 | And now, the end is near..."
166,politics,"Joe Biden defeats Trump in Pennsylvania, giving him enough electoral votes to win the presidency"
167,politics,"Joe Biden will be president, but there will be no Green New Deal | Without Congress, he’ll be limited to executive action, just like Obama."
168,politics,Kamala Harris to speak before Joe Biden in TV address tonight
169,politics,Bannon's lawyers move to withdraw from criminal case following comments about Fauci
170,politics,Los Angeles voters just delivered a huge win for the defund the police movement - LA’s “Yes on J” campaign flipped the message from defunding cops to investing in everything else. It worked brilliantly.
171,politics,Trump has not prepared a concession speech: report
172,politics,Joe Biden: The Decency Is the Point
173,politics,Romney says Trump ‘damages the cause of freedom’ with election conspiracies | Mr Romney joins a growing list of Republicans criticizing how the president has handled his dwindling chances at re-election
174,politics,Ocasio-Cortez defends progressives from blame for Democratic 'underperformance'
175,politics,"Brooklyn state senate staffer in ‘Black Lives Matter’ shirt removed from polling site by cops, threatened with arrest"
176,politics,Voters know Trump isn’t just a bad president. He’s a bad person.
177,politics,Where’s the Blue Wave? Look in Georgia The state delivered Black and suburban votes to the Democrats without the drag of Republican gains.
178,politics,"Donald Trump's speech Thursday showed if he can't win, he'll make sure all of America loses"
179,politics,How Stacey Abrams became the 'architect' of Biden's Georgia surge
180,politics,ACLU Sues ICE and DHS to Uncover Information About COVID-19 Response
181,politics,"Trump efforts to challenge election results 'are a gift to America's adversaries,' foreign policy experts say"
182,politics,Trump’s attacks on mail-in ballots rankle some military vets
183,politics,Trump has told people he has no plans to concede even if his path to victory is blocked
184,politics,Fact check: Trump delivers the most dishonest speech of his presidency as Biden closes in on victory
185,politics,"Joe Biden's victory is imminent after he pulls ahead in Pennsylvania, Georgia. Biden has taken narrow leads in two key battleground states — major media outlets likely to call the race shortly"
186,politics,Republican Martha McSally Has Lost An Arizona Senate Seat For The Second Time In Two Years
187,politics,"Trump and his aides are reportedly 'very anxious' Fox News will call Pennsylvania, clinching Biden victory"
188,politics,"Losing an election, Trump chooses to slander American democracy"
189,politics,"As Centrist House Democrats Attack Medicare for All, Fox News Poll Shows 72% of Voters Want 'Government-Run Healthcare Plan'"
190,politics,President Trump Is Struggling to Face the Possibility That He Lost
191,politics,Biden widens lead over Trump in critical Pennsylvania
192,politics,Lincoln Project Founder: We need to reform American democracy
193,politics,Democratic Rep. Susan Wild wins reelection in Pennsylvania
194,politics,Democrats Flip House Seat in Atlanta Area That Was Top Target of Party
195,politics,How Stacey Abrams blew up Georgia’s electoral map
196,politics,Mary Trump says President Donald Trump is likely 'desperate' right now as he has 'no one to bail him out'
197,politics,"Chris Christie tells Trump to stop inflaming and show evidence of ""stolen"" election"
198,politics,Europe’s leaders on climate change are the first to congratulate President-elect Joe Biden
199,politics,Special Counsel’s Office Opens Hatch Act Investigation Into Trump’s Use of White House for Campaign Events
200,politics,Memo to centrist Democrats: Stop blaming progressives for House losses
201,politics,"German news website's front page features Donald Trump as ""the squatter"""
202,politics,"Hey, Fox News: Go home, you're drunk — it's time to admit that the Trump party's over | Trump's limp coup is falling apart, but right-wing media and certain GOP politicians don't know when to cut bait"
203,politics,Pennsylvania's Republican senator shoots down Trump's claims of voter fraud
204,politics,Trump's odds of winning through a recount are nearly impossible
205,politics,Biden Takes The Lead In Pennsylvania. There Is No Path Back For Trump l FiveThirtyEight
206,politics,Police evacuate area near Philadelphia ballot counting center over bomb threats
207,politics,Santorum urges giving Trump time to accept defeat: 'This is a very emotional time'
208,politics,"How Stacey Abrams, LaTosha Brown and other Black women changed the course of the 2020 election"
209,politics,A record-breaking 6 Native Americans were elected to Congress on Tuesday
210,politics,Police thwart alleged plot to attack Pa. Convention Center where votes are being counted in Philly
211,politics,“Overpaid Executive Tax” in SF hits firms that pay CEOs 100X more than workers
212,politics,"As Trump Melts Down, Biden Campaign—Verging on Win—Says It Will Be 'Perfectly Capable of Escorting Trespassers' From White House"
213,politics,Runoff Senate elections in Georgia could determine balance of the Senate
214,politics,Fox News reportedly told on-air talent not to refer to Joe Biden as the 'president-elect' even if the network calls the 2020 race for him
215,politics,Fact Check: Georgia's military ballots are not missing
216,politics,McConnell says big stimulus bill not needed after better-than-expected jobs report
217,politics,Backstory: We cut off President Trump's remarks about a “rigged” election night.
218,politics,2020 Latest: Biden adds to lead over Trump in Georgia
219,politics,Trump Allies Are Losing It
220,politics,"‘A dreaded two years’: Biden, allies gear up to face a GOP Senate"
221,politics,Biden to make prime-time address as he expands lead in swing states
222,politics,Activist Previously Accused of Scamming President’s Elderly Supporters Will Lead Trump Campaign’s Ballot Challenges
223,politics,Romney after Trump briefing: 'Counting every vote is at the heart of democracy'
224,politics,Discussion Thread: 2020 General Election Part 61 | The Land Down Under
225,politics,Los Angeles Trump Supporter Investigated for ‘Threats of Violence’ Over Election Loss
226,politics,How reality caught up with the reality TV president | The Trump show has been canceled.
227,politics,"AOC criticized Democrats for not trying hard enough with Latino voters, hours after Biden lost Florida"
228,politics,Georgia announces recount after presidential race too close to call
229,politics,What Lindsey Graham wants to be 'on the table' during vote tallies - This is a time in which people in positions of authority tell us who they really are. We should listen to what Lindsey Graham is saying about his character
230,politics,Stacey Abrams’ Georgia turning blue
231,politics,"Bolsonaro abandons 'friend' Trump after 2020 election, says he's 'not the most important person in the world'"
232,politics,Biden overtakes Trump in Pennsylvania
233,politics,Legal problems galore await Donald Trump if he loses reelection and his presidential immunity
234,politics,Philadelphia Mayor Tells Trump to 'Put His Big-Boy Pants On' While Count Continues
235,politics,George W. Bush-Era Attorney General Says Trump Lawyers Should Consider Backing Fraud Claims with Proof
236,politics,Hawaii Trump campaign chair says roving caravans ‘worked against’ the president
237,politics,Newt Gingrich: Bill Barr Should Arrest Poll Workers
238,politics,Biden Appears On The Verge Of Overtaking Trump In Pennsylvania
239,politics,Joe Biden takes the lead in Pennsylvania vote count Friday morning
240,politics,Discussion Thread: 2020 General Election Part 60 | The Cycle Continues
241,politics,Romney: Trump claim of stolen election 'recklessly inflames destructive and dangerous passions'
242,politics,Fox News' Biggest Hosts Go Full Election Conspiracy For Trump
243,politics,Trump lawyer calls military ballots cast in Nevada 'criminal voter fraud'
244,politics,"Georgia Senate Candidate Releases Cutest 'Attack' Ad: 'By The Way, I Love Puppies'"
245,politics,This Sure Isn’t the Election QAnon Wanted
246,politics,"Wait, Is Trump’s Campaign Encouraging Pennsylvania Voters to Mail-In Late Ballots? Sure Sounds Like It"
247,politics,Joe Biden to give speech tonight
248,politics,Are Trumpworld and Fox News Headed for a Messy Divorce?
249,politics,Vote shows Trump’s bullying brand of leadership still appeals to a surprising number of Americans
250,politics,Thousands of Facebook Groups buzzed with calls for violence ahead of U.S. election
251,politics,"'Time for a cool head': Germany urges Trump to be calm, while UK stays silent"
252,politics,Study Considers a Link Between QAnon and Polling Errors
253,politics,MSNBC Bails Out of ‘Dangerous’ Trump Speech After 30 Seconds
254,politics,"Trump Just Spoke. He Was Dishonest, Desperate, and Dangerous."
255,politics,"Romney: Trump's election fraud claim wrong, 'reckless'"
256,politics,"Sen. Mitch McConnell calls for every vote to be counted, ignoring Trump's claims."
257,politics,"White evangelical Christians stick by Trump again, exit polls show"
