,subreddit,title
531,politics,"Biden remains in election limbo as Trump tries to sue his way to a second term President’s team continues alleging voter fraud, but have not released any evidence as count plods on"
532,politics,Why Recounts Are Not Likely To Reverse The Tide Against Trump
533,politics,"""This is getting insane"": Republicans rebuke Trump over baseless election claims"
534,politics,Two Arrested With Guns After Police Get Tip of Convention Center Threat
535,politics,"U.S. Postal Service says 1,700 ballots found in Pennsylvania facilities"
536,politics,"The Supreme Court case that could kill Obamacare, explained"
537,politics,Biden’s Campaign Wants You All To Chill Out. Trump’s Campaign Wants You All To Freak Out.
538,politics,News Media Waits … and Waits … to Make Historic Call
539,politics,Trump’s PA Strategy Is to Use the Courts to Toss Votes Out. It’s Not Working.
540,politics,Advocates race to find voters to correct flawed ballots
541,politics,‘The risks are now off the table’: Wall Street looks forward to Biden presidency
542,politics,"Georgia recount could take weeks, but almost certainly won't matter."
543,politics,Republicans break from Trump immediately after wild and false speech
544,politics,Discussion Thread: 2020 General Election Part 56 | Results Narrowing
545,politics,"Meet Kamala Harris, America's vice president-elect"
546,politics,"Russian media serve up smugness, mockery after U.S. vote"
547,politics,Trump turns angry as possible defeat looms
548,politics,Why Trump’s Elections Challenges Are Nothing Like Bush v. Gore
549,politics,"Trump's family tells GOP to ""have some backbone"" as some shy away from Trump's claims of victory and election fraud"
550,politics,"Like it or not, a Trump self-pardon may be coming soon"
551,politics,Trump vows to keep fighting amid Republican rebukes
552,politics,White Voters in Swing-State Counties Send the GOP a Warning.
553,politics,Why Russia Can Claim Victory as Trump Casts Doubt on the U.S. Presidential Vote
554,politics,Colorado Voters Want Wolves Back In Colorado. Now Comes The Hard Part.
555,politics,Networks cut away from Trump's White House address
556,politics,Group including Trump's own former top adviser launches $6 million ad to counter 'misinformation' on counting votes
557,politics,"Trump could be banned from Twitter after he leaves office, company's rules indicate"
558,politics,Head of nuclear weapons agency unexpectedly resigns
559,politics,"Georgia heading for recount as race too close to call, says top official"
560,politics,Donald Trump's baseless vote fraud claim opens cracks in Republican ranks
561,politics,Biden got a lift from young Black Americans on the road to victory
562,politics,"How an Oregon Measure for Universal Preschool Could Be a National Model - Creators of the Portland-area approach tried to avoid the pitfalls of similar policies elsewhere, and are giving teachers large raises."
563,politics,Secret Service plans to ramp up protection of Biden in anticipation of his possible win
564,politics,A red state is capping interest rates on payday loans: ‘This transcends political ideology’
565,politics,NY Gov Cuomo says pressure on state lawmakers to legalize marijuana
566,politics,"We 'Definitely Could' Know Pennsylvania's Results by the End of the Day, Secretary of State Says"
567,politics,Counties with worst virus surges overwhelmingly voted Trump
568,politics,Biden expands lead in Nevada
569,politics,What’s Left to Count in a Possible Day of Decision for Biden
570,politics,Federal judge rejects GOP effort to delay Nevada ballot count
571,politics,Biden’s building momentum brings ‘relief for us all’ in Danbury area
572,politics,Marilyn Strickland's Black and Korean American roots are historic 1st for Congress
573,politics,"Alaska has the slowest ballot-counting process in America. The top election official says security is the priority, not speed."
574,politics,17-year-old becomes youngest elected official in Kentucky
575,politics,Rudy Giuliani: from hero of 9/11 to leader of Trump's last stand
576,politics,Trump-linked figures have boosted #StopTheSteal movement
577,politics,What the hell is happening in Georgia? Senate race runoff rules explained as vote count continues
578,politics,Trump’s path to electoral victory is disappearing. So are his legal avenues.
579,politics,Trump faces tough road in getting Supreme Court to intervene
580,politics,Biden poised to win presidency after record turnout in turbulent election
581,politics,"Trump's speech was pathetic, but his authoritarianism is still dangerous"
582,politics,"Postal carrier arrested at Peace Bridge with mail in his trunk, including absentees"
583,politics,"After This U.S. Election, the Case for Online Voting Is Stronger Than Ever"
584,politics,Anderson Cooper says Trump acting like an 'obese turtle on his back flailing in the hot sun'
585,politics,Confused Trump Supporters Can't Decide Whether to 'Stop the Count' or 'Count Every Vote'
586,politics,Mulvaney says Trump will 'absolutely' facilitate peaceful transition of power if Biden wins
587,politics,The President of America is Looking Like a Mad English King
588,politics,A judge threatens the postmaster general over slow execution of sweeps for undelivered ballots.
589,politics,Trump blames Democrats for late-counted mail ballots. He should blame the GOP.
590,politics,Runoff Senate elections in Georgia could determine balance of the Senate
591,politics,Georgia judge throws out Trump’s lawsuit over voter fraud in a blow to his electoral hopes
592,politics,Pro-Trump protesters decry the vote-counting
593,politics,"Biden Takes Trump’s Lead in Pennsylvania, Democrats Say He’s Now Unassailable"
594,politics,Philadelphia police probe alleged plot to attack vote counting venue
595,politics,"Republicans, Now Is the Time to Step Up"
596,politics,"Florida poll worker details alleged harassment, assault from Trump supporters: 'We were in a war zone'"
597,politics,"Too close to call: Georgia will recount votes for president because of a slim margin, secretary of state says"
598,politics,Here are the legal challenges Trump's campaign has filed to dispute the 2020 election results
599,politics,Biden Pulls Ahead By Narrow Margin In Pennsylvania
600,politics,Fox News Gets Ready to Dump Trump
601,politics,Trump told one falsehood after another about the presidential race. Here are the facts.
602,politics,"Diverse Gay, Transgender Candidates Win State, Federal Offices"
603,politics,‘Come on Now’: Michigan Judge Scoffs at and Tosses Trump Campaign Lawsuit Backed by ‘Hearsay’ Evidence
604,politics,Donna Brazile: Trump election lawsuits are a dangerous un-American assault on democracy
605,politics,Democrat Mark Kelly projected to win Arizona Senate seat
606,politics,Election results: How Joe Biden won and Donald Trump lost
607,politics,Pelosi confident Biden will win presidency
608,politics,Sirota: Lincoln Project election efforts to swing GOP votes from Trump 'epic failure'
609,politics,Trump's Pennsylvania lawsuits invoke Bush v. Gore – but the Supreme Court probably won't decide the 2020 election
610,politics,Networks cut away from Trump’s White House address
611,politics,Creepy Texts Sicced Trump Supporters on Philly Vote-Count
612,politics,Discussion Thread: 2020 General Election Part 55 | I Can't Drive
613,politics,Jared Kushner's Company Reportedly Moves To Evict Hundreds As Pandemic Rages
614,politics,"Poll workers signed up to help voters. Instead, we were abused by Trump supporters."
615,politics,Postmaster General DeJoy Defies Federal Judge as Mail-In Ballots Surge for Biden
616,politics,Biden takes lead in Pennsylvania and Georgia as he inches closer to beating Trump
617,politics,2020 Latest: Pennsylvania GOP turns to US Supreme Court
618,politics,Allan Nairn: Trump & Republicans Use Legal & Physical Means in Attempted Coup Against Democracy
619,politics,Omar and Tlaib Credited as 'Major Factors' in Securing Biden Victories in Minnesota and Michigan
620,politics,"U.S. counties with highest virus surges overwhelmingly voted Trump, analysis shows"
621,politics,Republicans seeking to raise at least $60 million to fund Trump legal challenges - sources
622,politics,Georgia Judge Throws Out Trump Campaign Lawsuit That Produced Exactly Zero Evidence of Fraud
623,politics,"U.S. Postal Service delivered 40,000 votes nationwide Thursday: lawyer"
624,politics,Trump's demand to throw out ballots arriving after Election Day would break the law and disenfranchise military voters
625,politics,Kevin McCarthy goes further than most to echo Trump's worst claim
626,politics,What Is Wrong With 68 Million Americans? How Trump’s Mental Illness Infected 48% of the Electorate
627,politics,Trump slams Twitter as ‘out of control’ for censoring his tweets
628,politics,It Might Take a Miracle for Joe Biden to Reconcile America
629,politics,Susan Collins: 'We must all respect the outcome of elections'
630,politics,"Biden now leads Trump in Georgia, where the count continues."
631,politics,Discussion Thread: 2020 General Election Part 53 | Bottles of Beer on the Wall...
632,politics,Georgia Senate race: Why the state has runoff elections
633,politics,Record-breaking number of Native Americans elected to Congress Four Native Americans won reelection and two newcomers were elected to the House.
634,politics,Graham: Biden 'deserves a Cabinet' if he wins
635,politics,"Trump tweets 'Stop the count!' But if the vote were stopped, Joe Biden would win the presidency"
636,politics,Viral video showing 'voter fraud' is actually a cameraman moving equipment
637,politics,"'There will be a recount in Georgia,' Secretary of State says of tight presidential race"
638,politics,George Gascón will be L.A. County's next district attorney as incumbent Jackie Lacey concedes
639,politics,17-year-old becomes youngest elected official in Kentucky
640,politics,Donald Trump's most historic and dishonest press conference
641,politics,"Fox News tells anchors not to call Biden 'President-elect,' then seems to change its tune"
642,politics,Key Republicans quickly fall in line behind Trump’s attempt to undermine the election
643,politics,Trump blames conspiracies and pollsters as he refuses to accept expected results
644,politics,Mitch McConnell Has Let It Be Known He Will Continue to Be an Obstructive Jackass If Joe Biden Wins
645,politics,"Trump campaign says ‘election is not over’ as Biden takes leads in Pennsylvania, Georgia"
646,politics,Postal Worker Arrested And Charged With Failing To Deliver Over 800 Pieces Of Mail Which Included Three Absentee Ballots
647,politics,How much damage can Trump do on his way out? Expect the worst.
648,politics,"To stay or cut away? As Trump makes baseless claims, TV networks are faced with a serious dilemma"
649,politics,Why turnout for Trump is a major blow to public health
650,politics,"Alaska has the slowest ballot-counting process in America. The top election official says security is the priority, not speed."
651,politics,Here's why the fate of DC statehood could lie in the hands of Georgia voters
652,politics,"WVGOP ‘refuses’ outcome of ‘fraudulent’ election, supports Pres. Trump"
653,politics,Fact check: Trump fabricates election corruption
654,politics,Graham says Biden 'deserves' a Cabinet if he wins
655,politics,Joe Biden’s Magic
656,politics,Trumpers Lash Out As Establishment GOP Shoves Them To Arms Length
657,politics,"US results: 'Look at us, we matter’"
658,politics,"Colorado regulators give initial OK to ban on flaring of oil, gas wells to curb methane pollution"
659,politics,"How Joe Biden, the ultimate insider, defeated Donald Trump, the ultimate outsider"
660,politics,Discussion Thread: 2020 General Election Part 54 | How Many More?!
661,politics,Philadelphia police arrest armed men near convention center where ballots being counted
662,politics,Trump says Biden should not falsely claim victory
663,politics,Trump and Biden protesters duel outside vote-counting centers in cliffhanger election
664,politics,AOC Blasts Dem. McCaskill's Explanation for Party Losing Voters: 'Why Do We Listen to People Who Lost Elections?'
665,politics,"Kayleigh McEnany suggests Pennsylvania should toss out all mail ballots that arrive after Election Day, even though the Supreme Court said they should be counted up to 3 days after"
666,politics,Here's why the vote count is still going in key states
667,politics,"Biden pulls ahead in Pennsylvania and Georgia, closes in on 270 after Trump insists ‘they’re trying to steal an election’"
668,politics,Trump campaign loses another 2 ballot counting battles in Michigan and Pennsylvania
669,politics,"Georgia presidential vote likely to go to a recount, state official says"
670,politics,ICE Attempts to Deport Multiple Witnesses in Gynecologic Surgery Scandal
671,politics,2020 turnout is on pace to break century-old records
672,politics,"Georgia solidifies its swing-state status thanks, in part, to Stacey Abrams"
673,politics,"Trump’s Twitter account should be suspended after barrage of misinformation, top Democrats say"
674,politics,"McConnell, Graham warn GOP Senate majority on the line in Georgia"
675,politics,Joe Biden campaign says government can eject 'trespassers' from White House as Donald Trump declares US election 'not over'
676,politics,"Biden takes 5,500 vote lead in Pennsylvania"
677,politics,Why the Trumpy Supreme Court Will Give Him the Finger
678,politics,Biden Calls on Americans to Stop ‘Treating Our Opponents as Enemies’
679,politics,"America’s anti-democratic Senate, by the numbers"
680,politics,Campaign spending continues in Georgia Senate runoffs
681,politics,Biden on cusp of presidency after gains in Pennsylvania
682,politics,'Dangerous & wrong' | Rep. Will Hurd condemns baseless Trump remarks on vote count
683,politics,"In a rare move, Trump appointees bust union, hit federal immigration judges"
684,politics,Senate Control To Be Decided By Two Georgia Runoff Elections in January
685,politics,"Philadelphia demonstrators dance to YMCA, gather outside convention center as ballots counted"
686,politics,Pelosi formally seeks another 2 years as speaker
687,politics,Pennsylvania Republicans ask Supreme Court to enforce separation of late-arriving ballots
688,politics,America Has Yet to Achieve Racial Equity in Cannabis Reform. New Jersey Is Hoping Dianna Houenou Can Change That
689,politics,North Carolina Keeps Breaking My Heart
690,politics,Trump’s Forever Campaign Is Just Getting Started
691,politics,USPS finds 815 remaining ballots in court-mandated sweeps in Texas
692,politics,Social media erupts after Trump's 'meltdown' speech
693,politics,North Carolina Republicans seek data to resolve top races
694,politics,We Might Be About To Find Out Who Was On Trump’s Second-Term Purge List—Even If He Loses
695,politics,The political winds in the U.S. are swirling
696,politics,Pelosi celebrates likely Biden win after years of personal clashes with Trump
697,politics,Biden campaign says victory is 'imminent'
698,politics,"Trump, allies pledge fight in election as some acknowledge possible defeat"
699,politics,Vox live results: Joe Biden wins the presidency
700,politics,Georgia secretary of state confirms there will be a recount
701,politics,Why AP hasn't called Pennsylvania
702,politics,"Biden overtakes Trump in Pennsylvania, putting him on the verge of victory"
703,politics,"Biden Takes Lead In Pennsylvania; Win Would Decide Presidency | Many news outlets, including the Associated Press, have not yet made the call and Trump is not conceding."
704,politics,Late-night TV hosts express shock at close election: ‘I feel like I overestimated the American people’
705,politics,Is The Presidential Election Over?
706,politics,"Trump wins white evangelicals but Catholics are split, AP survey finds"
707,politics,"Arizona secretary of state responds to potential Trump challenge: ""No legal ground for us to stop counting"""
708,politics,Georgia voters will decide which party controls the Senate in 2 unusual runoff races in January
709,politics,Trump Goes to Court to Avoid Being a ‘Loser’
710,politics,"A Bipartisan Climate Policy? It Could Happen Under a Biden Administration, Washington Veterans Say"
711,politics,We’re Just at the Beginning of a Long Struggle for Justice
712,politics,"Trump's abusing his position by trying to halt vote count, says top international election observer"
713,politics,"Georgia heading to recount, top election official says"
714,politics,Trump Jr branded 'reckless' for urging ‘total war’ over election results
715,politics,Discussion Thread: 2020 General Election Part 50 | Results Narrowing
716,politics,"Democrat Mark Kelly projected to win Arizona Senate race, flipping a seat"
717,politics,Election Observation Team Says No Evidence For Trump's Fraud Claims
718,politics,Pennsylvania court orders some provisional election ballots set aside
719,politics,US election 2020: Donald Trump's speech fact-checked
720,politics,Joe Biden says he will rejoin the Paris climate agreement on the first day of his presidency if he wins the election
721,politics,"As nation looks on, state officials say at least 190,150 ballots still uncounted in Nevada"
722,politics,"Progressive economic policies enjoy broad bipartisan support, but progressive candidates don't. Here's what Democrats candidates need to do to attract these voters."
723,politics,Lawyers from both parties puzzled by Donald Trump's election legal strategy
724,politics,Nancy Pelosi seeks reelection as speaker of the House
725,politics,2020 US election: Biden edges ahead of Trump in battleground state of Georgia
726,politics,Panicked Trump falsely claims fraudsters handling vote count as Biden’s lead expands in nail-biter election
727,politics,Trumpworld rages behind the scenes
728,politics,Election observer says no evidence for Trump’s fraud claims
729,politics,Andrew Yang: Working class sees Dems as 'coastal urban elites' who care about 'policing cultural issues'
730,politics,What are the odds of Democratic wins in the Georgia runoffs?
731,politics,Discussion Thread: 2020 General Election Part 59 | Results Narrowing
732,politics,Discussion Thread: 2020 General Election Part 52 | Results Narrowing
733,politics,Why Decision Desk HQ and Insider called the election for Joe Biden
734,politics,What happens if Trump refuses to concede US election?
735,politics,Discussion Thread: 2020 General Election Part 51 | Results Narrowing
736,politics,Los Angeles District Attorney Jackie Lacey concedes to former San Francisco DA George Gascon after bitter race
737,politics,"Biden overtakes Trump in Georgia, Pennsylvania in too-close-to-call race"
738,politics,What is ballot 'curing?' Election officials will call you if your signature didn't match
739,politics,Trump supporters pray outside of Clark County Election Department in Nevada
740,politics,Trump doesn't have to concede. But it could affect Biden's Secret Service protection.
741,politics,'This is getting insane': Republicans say Trump's attacks on election integrity are dangerous
742,politics,Trump is turning to traditional media to amplify false claims as Twitter cracks down
743,politics,Recounts: What are the rules in key contested states?
744,politics,"Georgia presidential vote likely to go to a recount, state official says"
745,politics,'Not rooted in reality': News channels cut away as Trump delivers 17-minute tirade of election conspiracy theories
746,politics,GOP leaders press Trump team to detail fraud charges as they cautiously navigate the President
747,politics,Is This Really The Best We Can Do? This Muddled Conclusion Uncovers Fundamental Flaws in How We Select a President
748,politics,Judge throws out Trump campaign's Georgia lawsuit.
749,politics,Former GOP Prosecutor And Voter Fraud 'True Believer' Says Trump 'Smells Of Desperation'
750,politics,Trump Jr. calls out '2024 GOP hopefuls' for 'total lack of action' in ballot-counting fight
751,politics,"Mitch McConnell is already preparing to torpedo Joe Biden's Cabinet picks. A source close to the majority leader tells Axios that the GOP won't approve any ""radical progressives"" from Biden"
752,politics,Editorial: Election interference is Trump’s strategy to the bitter end
753,politics,Philadelphia election officials continue vote count as Trump tries to create chaos
754,politics,"NBC makes call: Ossoff, Perdue head for runoff in Georgia"
755,politics,Michigan Secretary of State: All votes are counted
756,politics,Why Trump's claims of voter fraud just don't make sense
757,politics,Counties with worst virus surges overwhelmingly voted Trump
758,politics,Biden takes the lead in Georgia as vote counting continues
759,politics,Trump’s Legal Strategy for Challenging the Election Is One More Trumpist Fantasy
760,politics,"Kemp avoids Trump fraud claims, but GOP rep calls state election handling ‘embarrassing’"
761,politics,Former Trump campaign chief Parscale reportedly planning to write a book
762,politics,Fight for Senate majority boils down to Georgia
763,politics,Biden gets extra Secret Service protection in case he declares victory
764,politics,Trump camp drops Nevada appeal in mail ballot counting case
765,politics,Assembly Speaker Robin Vos to investigate election after Trump alleges fraud without evidence
766,politics,2 Men Found Outside Pennsylvania Convention Center Held As Police Investigate Threat Of Attack
767,politics,"Lindsey Graham, Ted Cruz back Trump's baseless claims of rigged election"
768,politics,"Bill Barr, Trump Henchman, Is Sending Armed Agents to Ballot-Counting Locations"
769,politics,Biden pulls ahead of Trump in Georgia
770,politics,Pennsylvania vote count on ‘home stretch’ as Trump lead shrinks
771,politics,Around 100 President Trump supporters gather in downtown Raleigh
772,politics,"Biden ahead in Georgia, Pennsylvania; Trump attacks process"
773,politics,US election results - live updates: Trump loses lead over Biden in Georgia as president repeats fraud lies
774,politics,The biggest Trump meltdown the world has ever seen is imminent. Be prepared
775,politics,'Bernie Sanders is a wizard': 'Tonight Show' clip with eerily accurate election predictions goes viral
776,politics,"Georgia Presidential Race Likely Headed For Recount, Secretary Of State Says"
777,politics,A New Administration Won’t Heal American Democracy
778,politics,"When America needs an American, Mitch McConnell chooses to be a Republican — again"
779,politics,Republican Calls to Defy the Will of the Voters Completely Ignore Recent SCOTUS Precedent on Faithless Electors
780,politics,The words which may have cost Trump the election
781,politics,"Trump’s power on Twitter, Facebook will outlive his presidency"
782,politics,This election brings 4 important changes to America and the world Scott Gilmore: While votes are still being counted it is already clear that America's dangerous politics and its declining place in the world are the new normal
783,politics,Trump National Security Officials Horrified by His Election Lies
784,politics,Shepard Smith cuts off Trump press conference for 'absolutely untrue' claims about election
785,politics,"Protesters damage Commissioner Ryan’s home, arson at City Hall"
786,politics,QAnon supporter Marjorie Taylor Greene censored by Twitter after Georgia election win
787,politics,Biden pulls ahead of Trump in Georgia
788,politics,"Election 2020 live updates: Georgia will recount votes, secretary of state says, as Biden holds razor-close lead"
789,politics,"Latinos for Trump, Arizona vote for Biden shows diversity of Hispanics in US"
790,politics,U.S. imposes sanctions on Lebanese president's son-in-law
791,politics,"Jon Meacham: It’s fitting that Trump, who tore down our norms, will leave the office doing exactly that"
792,politics,815 Mail-In Ballots Found In Sweep of Texas USPS Processing Facilities
793,politics,"Biden Takes Leads In Pa., Ga., Putting Him On Cusp Of Electoral College Win"
794,politics,"Georgia state likely to go through recount in U.S. presidential election, secretary of state says"
795,politics,Welcome to Election Purgatory
796,politics,"Even if Trump loses, his cruelty, lies, and bullying will haunt America for years to come"
797,politics,Results Now Showing Biden Ahead in Georgia
798,politics,CNN's Dana Bash: Trump loss in Arizona would be 'John McCain's last laugh'
799,politics,"Tea party-linked activists protest against 'election fraud' in US cities. FreedomWorks, a conservative advocacy group that protested coronavirus lockdowns, and other groups organize rallies targeting Democratic cities"
800,politics,Trump's Italian cheerleader spreads baseless conspiracy theories over votes
801,politics,Judges in Michigan and Georgia dismiss Trump campaign lawsuits
802,politics,Facebook and Twitter struggle with online fury from Trump supporters - Social media platforms take measures to address rising anger as poll claims intensify.
803,politics,Kudlow: 'I think there will be a peaceful transfer of power' if Trump loses
804,politics,"YouTube will not remove popular ‘Trump Won’ video, despite the fact he has not"
805,politics,US election: Merkel's foreign minister says Trump's claims 'adding fuel to fire'
806,politics,"If Trump loses, the recriminations are going to get very ugly"
807,politics,Joe Biden takes the lead over President Trump in Pennsylvania as ballot counting continues
808,politics,"Trump didn't create the country's division, but he stoked it: What's next?"
809,politics,Discussion Thread: 2020 General Election Part 49 | Trump Delivers Remarks
810,politics,What happened in Detroit would've never happened in Ann Arbor
811,politics,Legal Scholars on the Importance of Counting Every Vote
812,politics,Trump campaign loses lawsuit seeking to halt Michigan vote count
