,subreddit,title
258,politics,"No, State Legislatures Cannot Overrule the Popular Vote"
259,politics,Donald Trump Jr. Mocked For Urging Dad To Declare 'Total War' Over Election
260,politics,Nevada becomes first state to recognize gay marriage in state constitution
261,politics,Republican Sen. Pat Toomey says Trump's claims of 'large-scale fraud and theft of the election are just not substantiated'
262,politics,Denver voters overturn pit bull ban
263,politics,"Michigan Judge Rejects GOP Attempt to Halt Ballot Counting in Detroit, Cites ‘No Evidence’ of Wrongdoing"
264,politics,So You Want to Go to War With Philadelphia? Good Luck With That
265,politics,Pelosi: ‘President-Elect Biden’ Will Have Mandate To Lead
266,politics,Taking time to count votes 'is not a sign of misconduct or chaos': How states prevent election fraud
267,politics,Biden doubles his lead in Nevada as more results released
268,politics,"Nevada Secretary of State Says 90 Percent of Remaining Uncounted Ballots Are in Clark County, a Democratic Stronghold"
269,politics,Georgia runoff gives new life to U.S. Senate bid of pastor of Martin Luther King's church
270,politics,Virginia men arrested over alleged plot to attack Pennsylvania vote-counting site
271,politics,We Don’t Have to Live in Mitch McConnell’s World
272,politics,"Anderson Cooper: Trump is an 'obese turtle on his back, flailing in the hot sun'"
273,politics,"Trump’s lead in Georgia shrinks to below 1,000 votes"
274,politics,GOP senator: Trump election fraud claims 'just not substantiated'
275,politics,The Trump campaign’s allegations of election fraud are a bunch of nonsense
276,politics,Armed men arrested near Pennsylvania Convention Center identified
277,politics,Ronna McDaniel asks for ‘time’ to produce specific claims of alleged voter fraud
278,politics,"Federal watchdog inquiring Trump campaign’s use of White House on Election Day, lawmaker says"
279,politics,"Lindsey Graham personally donates $500,000 to Trump campaign's legal fund"
280,politics,"Philadelphia mayor tells Trump to 'put his big boy pants on' and concede, even as key states remain uncalled"
281,politics,"Federal judge rejects Nevada lawsuit, which claimed voter fraud, signature verification issues"
282,politics,Heart of John Lewis' district deals blow to Trump
283,politics,Donald Trump is probably going to ghost us
284,politics,Trump's wild claims test limits of Republican loyalty
285,politics,Detroit police investigating bomb threat at TCF Center
286,politics,Trump Moves Into the Burn-It-Down Phase
287,politics,America's Disastrous Drug War Is Finally Unravelling
288,politics,"U.S. Postal Service finds 1,700 ballots at Pennsylvania mail-processing facilities"
289,politics,Family with ‘Dump Trump’ sign finds electric meter ripped off their home
290,politics,Biden close to U.S. election victory as a defiant Trump vows to fight
291,politics,Trump and GOP lawsuits thus far challenging few ballots with no proof of fraud
292,politics,Kamala Harris makes history as the first woman to become Vice President.
293,politics,Biden inches closer to presidential victory as Trump’s chances of victory fade
294,politics,Donald Trump's malignant spell could soon be broken
295,politics,Report: Trump Plans to Barricade Himself in the Oval Office and Refuse to Come Out If Biden Wins
296,politics,Trump says Biden should not 'wrongfully' claim victory in presidential race
297,politics,Judge 'shocked' USPS disregarded order for postal inspectors to search for undelivered ballots
298,politics,"When Donald Trump is peddling outrageous lies, where is the line between reporting and enabling?"
299,politics,Pennsylvania Republican shoots down Trump's baseless claims of voter fraud in state Senator Patrick Toomey says there is ‘absolutely not’ any evidence of large-scale vofraud in the state
300,politics,"In Florida, Spanish-language misinformation embraces misleading Election Day claims"
301,politics,Flomaton police captain has resigned following controversial election-related Facebook comment
302,politics,America’s Next Authoritarian Will Be Much More Competent
303,politics,"2020 election to cost $14 billion, blowing away spending records"
304,politics,Wolves win in Colorado after vote for reintroduction by 2023
305,politics,Fox News Gets Ready to Dump Trump
306,politics,Fight for Senate majority boils down to Georgia
307,politics,Trump questions why mail-in ballots are going against him. He spent months baselessly attacking them
308,politics,Joe Biden leads in key states as count continues
309,politics,"Andrew Yang Criticizes Democratic Party, Says People Think They Care 'More About Policing Cultural Issues' Than Improving Lives"
310,politics,Trump’s False Election Fraud Claims Split Republicans
311,politics,2020 Latest: Biden lead over Trump in Nevada grows slightly
312,politics,Ivanka Trump and Jared Kushner being considered for an ‘intervention’ if president loses and refuses to leave White House
313,politics,A Trump Loss Means End of Twitter Special Treatment - The president's tweets will not be covered by Twitter's special policies for elected officials if his presidency ends in January.
314,politics,SC Senator Lindsey Graham pledges $500k to President Trump's legal defense amid fraud allegations
315,politics,Lindsey Graham refuses to dismiss idea to scrap Pennsylvania election results over Trump conspiracy theories
316,politics,Lindsey Graham says Joe Biden ‘deserves’ cabinet picks if elected
317,politics,"Trump Lies About Winning Election, Baselessly Accuses Democrats Of Cheating"
318,politics,Trump's vote margin in latest Maricopa County ballot count is well short of what he needs to catch Biden
319,politics,"‘Here we go, guys!’ Joe Biden supporters await news at Wilmington tailgate gathering"
320,politics,Trump’s legal team makes no significant progress in election fight
321,politics,'The place where we put this country back on track': How Joe Biden turned Georgia purple
322,politics,"MAGA World’s Latest Election Gambit: Whatever Happened To The Coronavirus, Huh?!"
323,politics,The President of America is Looking Like a Mad English King
324,politics,Judge nixes Trump bid to stop Philadelphia vote count
325,politics,The ‘Blue Wave’ Crashed Into a Wall of White Supremacy. How Can Democrats Break Through?
326,politics,The Republican Party Is the Reason It’s Taking So Long to Count Votes in Pennsylvania
327,politics,Mitch McConnell Referenced Martin Luther King Jr. in His Victory Speech. MLK's Family Graciously Invite Him to STFU
328,politics,Facebook employee warned of spike in company's internal 'violence and incitement trends' metric during election week
329,politics,PA Republicans seek emergency order from US Supreme Court mandating late-arriving ballots not be counted
330,politics,Greta Thunberg pokes fun at Donald Trump's election reaction with throwback tweet
331,politics,2020 Latest: Pa. judge rejects GOP case on provisional votes
332,politics,"Crenshaw hits back at Greene, tells her to 'start acting like' a member of Congress"
333,politics,"Trump backers, poll workers clash in Florida: ‘My early voting site was almost like a war zone’"
334,politics,"Biden on verge of winning U.S. presidency, leads in Pennsylvania, Georgia"
335,politics,"Sean Spicer, breaking with Trump, says he sees no signs of voter fraud"
336,politics,"Philly Mayor Jim Kenney: Trump Needs To ‘Put His Big Boy Pants On’ And Admit Defeat | “He needs to acknowledge the fact that he lost, and he needs to congratulate the winner,” Kenney said."
337,politics,Tucson police: Man mistaken for graffiti vandal dies in Election Day clash
338,politics,White House aide Ja'Ron Smith leaves post
339,politics,"What ""reasonable"" Republicans? GOP leaders are boosting Trump's attack on democracy"
340,politics,Judge could call postmaster general to testify over missed ballot sweep deadline
341,politics,Mark Kelly defeats Arizona GOP Sen. Martha McSally in key pickup for Democrats
342,politics,‘It’s crap’: DeSantis office ‘leaks’ state records to fuel COVID-19 death ‘conspiracy’
343,politics,There's A Hilarious Way To Tell If Someone Is Anti-Trump In The Deaf Community And It's Going Viral
344,politics,"Marilyn Strickland's Black and Korean American roots are historic 1st for Congress | Strickland, who was born in Seoul, will be the first Korean American Congresswoman and the first Black Congress member from Washington"
345,politics,Memo to centrist Democrats: Stop blaming progressives for House losses.
346,politics,Study Considers a Link Between QAnon and Polling Errors
347,politics,GOP asks Supreme Court to halt count of Pennsylvania ballots received after Election Day as Biden takes lead
348,politics,CNN’s John King tells us how he’s still standing
349,politics,Kansas court expands parental rights of same-sex couples
350,politics,Trump abruptly changes tone: 'I will never give up fighting for you and our nation'
351,politics,Joe Biden can save us from the precipice
352,politics,Judge orders Trump administration to reveal PPP loan data it sought to obscure
353,politics,Twitter Has Labeled 38% of Trump’s Tweets Since Tuesday
354,politics,Trump’s Divorce From Fox News Is Getting Ugly
355,politics,Voters of Color Are Helping Flip GOP Strongholds. We Know Exactly Who Should Get Their Flowers for That
356,politics,"Georgia Senate Contest Heads to Runoff Between Perdue, Ossoff"
357,politics,Trump’s False Election Fraud Claims Split Republicans
358,politics,Biden takes the lead in Georgia as margin narrows in Pennsylvania
359,politics,Anderson Cooper described Trump as “an obese turtle on his back flailing in the hot sun”
360,politics,CNN's Phillip: 'Historical poetry' that Trump tenure may end with Black woman in White House
361,politics,Trump aides consider throwing rally as Biden lead grows: report
362,politics,"Pressure mounts, rifts emerge at Fox News over election"
363,politics,‘My sense is that we lost’: Trump campaign aides grapple with dwindling odds
364,politics,Transgender representation to nearly double in state legislatures
365,politics,Why they love Trump to death: explaining America's 48 per cent
366,politics,Lincoln Project founder says Fox News' Tucker Carlson is frontrunner for 2024 GOP nomination
367,politics,Trump-associated firm helped send unmarked texts urging vote protests in Philadelphia
368,politics,Spalding County sheriff says rumors about ballots found in dumpster not true
369,politics,Many Places Hard Hit By COVID-19 Leaned More Toward Trump In 2020 Than 2016
370,politics,Stacey Abrams instrumental in Democratic success in Georgia
371,politics,The NYPD’s Top Anti-Harassment Cop Might Be a Racist Troll
372,politics,"Under pressure from Trump allies, some Republicans echo president’s unsubstantiated claims of voter fraud"
373,politics,How Claims of Dead Michigan Voters Spread Faster Than the Facts
374,politics,Trump advisers are telling him it’s slipping away. There’s poetic justice here.
375,politics,Could a recount flip a key battleground? History says don't count on it.
376,politics,"Trump's last-ditch US election lawsuits not going well for president, experts say"
377,politics,Why Mark Kelly's Senate victory in Arizona is so striking
378,politics,'The vote is sacred': Biden says he has no doubt he has won but democracy requires patience
379,politics,Discussion Thread: 2020 General Election Part 59 | Results Narrowing
380,politics,Senate Control in Limbo as Two Georgia Races Go to Runoffs
381,politics,"USPS rushes to deliver another 2,000 ballots in Pennsylvania, North Carolina before deadline | The Philadelphia, Pittsburgh and Charlotte ballots were part of more than 2,000 ballots discovered in dozens of postal facilities across the two states."
382,politics,"Biden on verge of winning U.S. presidency, leads in Pennsylvania, Georgia"
383,politics,Buffalo mail carrier arrested at U.S. Canada border
384,politics,"Steve Bannon says ""punk"" Twitter boss Jack Dorsey should be arrested for ""taking down the president"""
385,politics,Wisconsin Republicans press Pennsylvania Trump supporters to return ballots after Election Day
386,politics,State Legislatures Can’t Ignore the Popular Vote in Appointing Electors
387,politics,Nancy Pelosi formally announces run for reelection as House speaker
388,politics,Joe Biden campaign says 'trespassers' can be removed from White House
389,politics,Counties with worst virus surges overwhelmingly voted for Trump
390,politics,Ronna McDaniel asks for 'time' to produce specific claims of alleged voter fraud
391,politics,Philadelphia police detain two near vote-counting site after tip about armed people traveling to city
392,politics,"Georgia vote counting hopefully done before the Florida game, election official jokes"
393,politics,"Talk grows of Trump firings at Pentagon, CIA"
394,politics,Longtime ally Chris Christie calls on Trump to provide evidence of election fraud
395,politics,"Trump defence secretary has prepared resignation letter even before final election results, reports say"
396,politics,Protesters crying foul over vote counts stir safety concerns.
397,politics,"Video of ‘ballot stuffing’ is not from a Flint, Mich., polling place. It’s from Russia"
398,politics,The future of the Senate majority could hinge on two Georgia runoffs
399,politics,Twitter Permanently Suspends Steve Bannon Account After Beheading Comments
400,politics,"With GOP at crossroads, Trump team employs fear tactics in bid to keep Republican lawmakers in line"
401,politics,2020 Latest: Biden overtakes Trump in Georgia vote count
402,politics,Philadelphia Police Take Man Into Custody in Connection With Plot to Attack Vote-Counting Center: Reports
403,politics,"Civil Rights group, watchdog formally request Twitter suspend Trump's account over disinformation"
404,politics,Republicans break ranks with Donald Trump over baseless vote fraud claim
405,politics,"As Biden inches closer to victory, U.S. allies cautiously weigh outreach amid Trump threats"
406,politics,Trump’s Election Lawyers Are a Very Swampy Crew
407,politics,Republicans are at each other’s throats. Democrats shouldn’t be.
408,politics,Biden Takes Lead From Trump in Georgia for First Time
409,politics,"While Americans voted, the Trump administration quietly revoked the union rights of immigration judges, which could jeopardize their independence"
410,politics,Biden And Trump Supporters Clash In Lexington Over Election Results
411,politics,"Whether Donald Trump wins or loses the US election, the madness of America will reverberate for Australia over the coming years"
412,politics,Philadelphia police detain two after tip about armed group at ballot-counting site
413,politics,"Joe Biden's Almost Impossible Task Even if Joe Biden emerges victorious, the peaceful transfer of power still isn't yet a foregone conclusion. And as president, Biden would face the almost impossible task of reuniting a deeply divided nation."
414,politics,'Hopefully Amy Coney Barrett Will Come Through': Trump Legal Adviser Admits Campaign Is Pining for Supreme Court Rescue
415,politics,"Georgia Presidential Race Likely Headed For Recount, Secretary Of State Says"
416,politics,Kansas candidate behind revenge porn wins state House seat
417,politics,"Romney: Trump's election fraud claim wrong, 'reckless'"
418,politics,Joe Biden's security increased by Secret Service ahead of possible election win
419,politics,Ivanka Trump Was Floating Above This Week’s Mess. No Longer.
420,politics,"If Biden wins the election, Trump's Twitter will no longer protected by the 'world leader' exemption. He could face removal from the platform for violating 'public interest' policies."
421,politics,County says election worker in hiding after false claims of throwing out ballot
422,politics,"Trump needs ‘time’ to process loss, Top Republican says:"
423,politics,‘Count Every Vote' Protesters Dance to Go-Go on DC Streets
424,politics,Trump says Biden should not 'wrongfully' claim victory in presidential race
425,politics,Pennsylvania vote counters’ toil to extend into next week
426,politics,Detroit police investigate bomb threat near TCF Center; nothing found
427,politics,Anderson Cooper Stuns Viewers With Brutal Take On Trump's Latest Election Remarks
428,politics,Why Trump Can’t Afford to Lose
429,politics,'We demand a recount in Jesus' name:' RI Trump supporters hold rally
430,politics,‘Just Pathetic’: Trump Widely Condemned For Wannabe Dictator White House Statement
431,politics,Georgia Senate Race Between David Perdue And Jon Ossoff Edges Closer To A Runoff
432,politics,Donald Trump doesn't need to concede
433,politics,Biden expected to appoint Gensler to advise on Wall Street oversight: WSJ
434,politics,"'Time for a cool head': Germany urges Trump to be calm, while UK stays silent"
435,politics,Getting beyond an incompetent Trump transition
436,politics,Utah AG taking leave of absence to 'prepare and support' election litigation outside of state
437,politics,Biden's nearly insurmountable math
438,politics,"Trump's Desperate Conspiracy Theories Won't Save His Presidency, but They Might Save His Ego"
439,politics,"Evangelicals stick with Trump, see upside even if he loses"
440,politics,Secret Service ramping up protection around Biden ahead of election call: reports
441,politics,"Kornacki: Biden takes the lead in Georgia, further gains possible"
442,politics,Advocates race to find Georgia voters who cast bad ballots
443,politics,Republicans seeking to raise at least $60 million to fund Trump legal challenges
444,politics,The count goes on -- with Biden on the cusp of presidency
445,politics,President Trump faces tough road in getting Supreme Court to intervene
446,politics,How Claims of Dead Michigan Voters Spread Faster Than the Facts
447,politics,Georgia voters have one day left to 'cure' rejected ballots; here's how it works
448,politics,"Even Fox News hosts aren't buying Kayleigh McEnany's attempts to spin a Trump campaign election suit : ""You're going to toss their ballot out if it doesn't come in until the day after or two days after?"" MacCallum asks"
449,politics,Trump the most anti-democratic president in modern US history
450,politics,Trump’s post-election purge has begun
451,politics,Armed pro-Trump crowd chants ‘Fox News sucks!’ at Arizona ballot protest
452,politics,Philadelphia mayor tells Trump to accept he lost – video
453,politics,Democrats Urge Supreme Court to Defer Acting in Ballot Case
454,politics,Video alleging possible vote-counting fraud in Detroit is actually a journalist pulling a wagon with camera equipment
455,politics,"Will Mitch McConnell back Trump's delusional last-ditch battle? So far the signs are ominous | McConnell doesn't actually believe Trump can win. But when it comes to maintaining power, he'll try anything"
456,politics,How claims of dead Michigan voters spread faster than the facts
457,politics,Why did so many Latinos vote for Donald Trump?
458,politics,Biden to deliver prime-time address with victory in sight.
459,politics,Election results: How Joe Biden won and Donald Trump lost
460,politics,Trump's wild claims test limits of Republican loyalty
461,politics,"McConnell, Graham warn GOP Senate majority on the line in Georgia"
462,politics,GOP senator: no evidence to support Trump vote-fraud claims
463,politics,We fact-checked President Trump's speech about the election. Here's what we found.
464,politics,"As vote count swings toward Biden, Trump's backers hit the caps-lock key on Twitter"
465,politics,Trump Won’t Accept Defeat. Ever.
466,politics,Democrat Joe Biden is now leading President Donald Trump in the battleground state of Pennsylvania
467,politics,Criminal justice reformer wins LA district attorney’s race
468,politics,Gwinnett’s final Friday tabulations add more votes to Biden lead
469,politics,"Joe Biden Takes Lead in Pennsylvania, Putting Democrat on Cusp of Defeating Donald Trump"
470,politics,"Counties with the worst COVID-19 surges overwhelmingly voted for Trump, analysis shows"
471,politics,My sense is that we lost’: Trump campaign aides grapple with dwindling odds
472,politics,Trump finally addressed the nation to let us all know he thinks he’s lost
473,politics,"Trump's lead in Georgia drops below 10,000 votes"
474,politics,2 men detained after police learn of possible threat to Philadelphia vote counting center
475,politics,2020 Latest: Biden increases lead over Trump in Nevada
476,politics,Trump's 'Spiritual Adviser' Holds Bizarre Prayer Service And Claims To Hear 'Sound Of Victory'
477,politics,Second-highest-ranking official at USAID ousted
478,politics,"Vote Gap in Georgia Remains Tight as Officials Anticipate Provisional, Military Ballots"
479,politics,'They Had One Job and They Blew It': Progressives Fire Back as Centrist Democrats in House Blame Left for Election Failures
480,politics,Trump's new campaign: Flurry of election lawsuits in search of strategy
481,politics,"Biden takes narrow lead in Georgia, putting White House in reach"
482,politics,"The Great State of Pennsylvania? No. The Greatest State. Also, Not a State."
483,politics,Unmarked texts linked to GOP firm urged vote protests in Pennsylvania: report
484,politics,"Donald Trump's speech Thursday showed if he can't win, he'll make sure all of America loses"
485,politics,"Biden expands paths to victory by pulling ahead in Pennsylvania, Georgia"
486,politics,Trump’s Election Lawyers Are a Very Swampy Crew. Several represent overseas interests.
487,politics,European Officials Are Criticizing Trump For Prematurely Claiming Victory And Spreading Misinformation
488,politics,Discussion Thread: 2020 General Election Part 58 | Results Narrowing
489,politics,Judge Voices Alarm at Odious Reported Conduct of Trump Appointee
490,politics,Why some Michigan election conspiracy theories don't add up
491,politics,Republicans are at each other’s throats. Democrats shouldn’t be.
492,politics,Fox News Hits a Dangerous New Low
493,politics,Trump’s Legal Strategy for Challenging the Election Is One More Trumpist Fantasy
494,politics,Police union files legal challenge against voter-approved oversight board
495,politics,The Nation Is Watching Pennsylvania As Joe Biden Is On The Cusp Of Winning The Election
496,politics,"Some Americans dance, others wield guns outside vote-tallying sites as counting draws to a close"
497,politics,"Joe From February: 'No Matter How This Race Ends, I’m Proud Of Joe Biden' | Morning Joe | MSNBC"
498,politics,A 2020 Biden election win will mean less if the Senate majority stays Republican
499,politics,The President Will Bring the Whole Temple Down on His Head If He Gets the Chance
500,politics,RNC seeking to raise at least $60 million to fund Trump legal challenges - sources
501,politics,Fact-checking Republican claim of illegal votes in Nevada
502,politics,Philadelphia police arrest armed men allegedly heading to vote-counting center
503,politics,"No, more mail-in ballots weren’t counted in a Pennsylvania county than were cast"
504,politics,"Greta Thunberg Trolls Trump with His Own Diss: 'Chill Donald, Chill!'"
505,politics,The Jolt: Why Georgia Republicans are endorsing Trump’s false claims of a rigged election -- in their GOP-controlled state
506,politics,"Virginia duo in custody for alleged threats against Philadelphia vote counters, police say"
507,politics,Trump has ‘no plans to concede’ election as Biden closes in on White House
508,politics,Rashida Tlaib slams ‘forever impeached’ Trump over Detroit fraud claims: ‘We know how count unlike him’
509,politics,"‘We believe we will win,’ says Al Gross in Alaska, lagging in Senate bid with half of votes counted"
510,politics,Trump should have lost in a landslide. The fact that he didn’t speaks volumes
511,politics,"Where’s the drama? Not in Florida, and that’s fine with elections officials"
512,politics,Republicans seeking to raise at least $60 mil to fund Trump legal challenges
513,politics,AOC pushes back on blaming progressives for Democratic House losses
514,politics,"Tony Blinken Will Get a Top Job in Biden Admin, Sources Say"
515,politics,Is the show finally over for Donald Trump? | US elections 2020
516,politics,Discussion Thread: 2020 General Election Part 57 | Results Narrowing
517,politics,Nobody Is Listening to Donald Trump
518,politics,Trump faces tough road in getting Supreme Court to intervene
519,politics,Panic-stricken Donald Trump Jr. calls for ‘total war’ in clueless tweet
520,politics,Delay of Presidential Election Result Casts Spotlight on Social Media’s Misinformation Problem
521,politics,Trump and His Pathetic Allies Are Yelling About Stealing the Pennsylvania Election or Getting a 'Do-Over'
522,politics,"Judges are tossing out President Trump's last-minute attempts to sue his way to victory one by one | ""Each has been rejected so far, and I'd rather not give them oxygen,"" election law expert Jon Sherman tells Salon"
523,politics,"Why Decision Desk called Pennsylvania, and the presidential race, for Joe Biden"
524,politics,Biden Expected to Appoint Gensler to Advise on Wall Street Oversight: WSJ
525,politics,Organized Labor Helped Boost Biden In Critical Battlegrounds | Some unions focused their efforts on driving Black and Latino turnout in urban areas of swing states.
526,politics,Trumponomics was always a lie A policy founded on Donald Trump’s desire to be popular has done lasting damage to the world’s largest economy.
527,politics,Why haven't we called Pennsylvania? Kornacki breaks it down.
528,politics,Michigan judge denies Trump campaign lawsuit to stop ballot count
529,politics,"As Biden’s lead grows, U.S. allies cautiously weigh outreach amid Trump threats"
530,politics,The Places Hit Hardest By COVID Went Overwhelmingly for Trump
