,subreddit,title
813,politics,Antrim County in Michigan to manually recount ballots after 'election software' error
814,politics,Donald Trump Jr. just promoted a brazen plan to steal the election
815,politics,Joe Biden breaks Obama's record for most votes ever cast for a U.S. presidential candidate
816,politics,"Biden Takes 5,500-Vote Lead Over Trump in Pennsylvania: President Donald Trump's initial lead of about 700,000 votes in Pennsylvania has dwindled; tens of thousands of mail-in ballots still need to be counted."
817,politics,Poll: Jewish voters favored Biden 77-21
818,politics,Trump’s “personal pastor” Paula White is losing it over a possible Biden victory
819,politics,Trump Says Mail-in Votes Are Suspicious Because They Overwhelmingly Favor Joe Biden. He's Wrong.
820,politics,US election results and maps 2020: All eyes on Georgia and Pennsylvania as final states prepare to declare
821,politics,"Twitter, Facebook flag Trump posts, battle spills to social media"
822,politics,Donald Trump predicts ‘lot of litigation’ in fight to retain presidency
823,politics,"Trump is feeling 'down,' starting to 'see this slip away' from him, CNN's Dana Bash reports"
824,politics,Biden triumph in Pennsylvania delivers him the 2020 presidential election
825,politics,Social Media’s Dance With Donald Trump Is Getting Clumsier
826,politics,"Analysis: Trump’s vote diatribe both shocking, unsurprising"
827,politics,US election 2020: Biden team 'elated' at battleground breakthroughs - but Trump staff say election not over yet | US News
828,politics,Crowd of protesters in Phoenix fired up by conspiracy theorist Alex Jones
829,politics,What The Hell Happened To Biden In Miami?
830,politics,Judge throws out Trump campaign's Georgia lawsuit
831,politics,A Muslim millennial was elected the country’s first out nonbinary lawmaker — in Oklahoma
832,politics,Portland rejects bid to cut $18 million more from police amid months of racial justice protests
833,politics,"Fox News tells anchors not to call Biden 'President-elect,' then seems to change its tune"
834,politics,Biden takes the lead in Pennsylvania - a win there would be decisive
835,politics,Donald Trump supporters - some armed with rifles and handguns - have descended on election counting centres where mail-in ballots continue to be tallied up.
836,politics,Georgia secretary of state says state will head to a recount
837,politics,The audacity of lies: Trump has been planning this all along
838,politics,"Discussion Thread: 2020 General Election Part 44 | This is Becoming a Chore, our Fingers are Sore, Do We Really Need Any More?"
839,politics,America Still Thinks It’s the Election Police
840,politics,Republicans Are Throwing Unsubstantiated Allegations of Fraud at the Wall and Hoping They Stick
841,politics,The stories behind the standout images from the U.S. election
842,politics,"Biden takes lead in Pennsylvania, with more votes to be counted"
843,politics,Coronavirus updates: US surpasses 100K cases in a day again; Missouri poll worker with COVID-19 dies after working election
844,politics,The Lincoln Project Was a Giant Grift
845,politics,Kudlow: ‘There will be a peaceful transfer of power’ if Biden wins
846,politics,"Pence sends Trump campaign email, warns to ""remain vigilant"" but doesn't claim election fraud"
847,politics,Secret Service reportedly sends more agents to Delaware in anticipation of potential Biden win
848,politics,Discussion Thread: 2020 General Election Part 46 | But Who's Counting?
849,politics,MSNBC's Joy Reid: Close presidential race shows 'great amount of racism and anti blackness' in US
850,politics,Trump supporters pray in front of Nevada building where votes are being counted
851,politics,Facebook Shuts Down “Stop the Steal” as Election Conspiracies Explode
852,politics,What happens if election results are contested?
853,politics,Videos show Trump protesters chanting 'count those votes' and 'stop the count' outside separate ballot-counting sites in Michigan and Arizona
854,politics,Armed man arrested amid alleged plot to attack Philly vote counting center
855,politics,Biden Leads Trump In Pennsylvania Vote Count; Contest Too Early To Call
856,politics,Senate boost for Democrats as two Georgia races look set for runoffs
857,politics,"Trump Latches On To Conspiracies, As Legal Battles Fail And Path To Win Narrows"
858,politics,"Without the Senate, a Biden Presidency Will Be Crippled Before It Begins"
859,politics,"Trump's fraud campaign is incompetent, hilarious, and terrifying"
860,politics,"In battleground state of Georgia, Biden overtakes Trump by 917 votes"
861,politics,The Russians have no need to spread misinformation. Trump and his allies are doing it for them
862,politics,"San Francisco voters approve taxes on highly paid CEOs, big businesses"
863,politics,The Supreme Court must avoid partisan overreach on election cases
864,politics,Trump lawyers petitioning supreme court have close ties to Brett Kavanaugh
865,politics,Discussion Thread: 2020 General Election Part 48 | Results Narrowing
866,politics,Two federal lawsuits filed after police in North Carolina used pepper spray to break up march to a polling place
867,politics,Georgia election results: Biden takes lead in count for crucial state for first time with nearly all ballots counted
868,politics,"2020 Election: Biden campaign says they will win Arizona, Pennsylvania and Nevada"
869,politics,"Biden takes the lead in Georgia, Pennsylvania as battleground vote counts trickle in"
870,politics,"Republicans Imply Pennsylvania Should Throw Out Popular Vote, Line Up Behind Fraud Lie"
871,politics,Eric Trump Busted For Fake Video Of Someone 'Burning 80 Trump Ballots'
872,politics,Biden cuts into Trump's lead in Pennsylvania
873,politics,Biden takes lead in Pennsylvania and Georgia
874,politics,"A massive ""Stop the Count"" Facebook group has ties to Republican operatives"
875,politics,Election results: Georgia will recount presidential votes - Chicago Tribune
876,politics,"Biden pulls ahead of Trump in Georgia, but the race isn't over"
877,politics,"Tusk Says Trump, Kaczynski Behave Like 'Bad-Tempered Brats'"
878,politics,Why some Michigan election conspiracy theories don't add up
879,politics,"US media cuts away from Trump's speech, citing 'false statements' and 'unfounded conspiracies'"
880,politics,Discussion Thread: 2020 General Election Part 47 | Results Narrowing
881,politics,White women didn't desert Trump in the election. Polls show some white men did.
882,politics,How to check if your ballot was rejected — and possibly fix it if it was
883,politics,"In a speech of historic dishonesty, Trump tried to reinforce his long-planned effort to retain power"
884,politics,'He's going full Robert Mugabe': Trump compared to notorious Zimbabwe dictator by former US ambassador
885,politics,Howard Stern shocked that Trump wasn’t crushed on Election Day
886,politics,Donald Trump's attack on election integrity cries for Republican come-to-Goldwater moment
887,politics,AP Fact Check: Trump fabricates election corruption
888,politics,"U.S. election: Joe Biden takes narrow lead in Pennsylvania, Georgia"
889,politics,'Fox News sucks!': Trump supporters decry channel as it declares Biden wins
890,politics,Kornacki: Pennsylvania vote counts continue to eat into Trump’s lead over Biden
891,politics,Networks cut away from Trump’s White House address
892,politics,10 new COVID cases connected to Suffolk County polling site
893,politics,Gore: This election is 'completely different' than 2000
894,politics,"Rising Democratic star Michael Tubbs risks reelection defeat, thanks in part to a Stockton blog"
895,politics,Race for House ag chair heats up
896,politics,John McCain's powerful election speech shows 'what's missing in 2020'
897,politics,Trump Doubles Down on False Victory Claim: ‘I Easily Win’ With Legal Votes
898,politics,The Disinformation Is Coming From Inside the White House
899,politics,GOP falls shorts of veto-proof majorities in Wisconsin legislature
900,politics,Feds investigating series of post office break-ins before Election Day
901,politics,Biden gains in Pennsylvania; Trump lead in Georgia under 500 votes
902,politics,Judge denies Trump campaign bid to halt Philadelphia count
903,politics,'This is getting insane': Republicans push back against Trump's false election claims
904,politics,US election 2020: Donald Trump's speech fact-checked
905,politics,US election: Facebook forced to change policies after Trump falsely claims victory
906,politics,The battle for the Senate hinges on Georgia
907,politics,Republicans break with Trump over push to halt vote count
908,politics,Facebook removes pro-Trump group for false election claims and some members calling for violence
